{
  "$schema": "./state.schema.json",
  "schema_version": 1,
  "program_id": "PSD2FUSION-COMPOSITING-PARITY",
  "status": "active",
  "updated_date": "2026-09-02",
  "baseline": {
    "repository": "46slv/PSD2Fusion",
    "default_branch": "main",
    "starting_head": "3ee00bfdb52f7f15a644c98a43bf9de723374d45",
    "claim": "FIRST_USABLE structure exists; Photoshop/reference pixel parity is unverified"
  },
  "reference_case": {
    "case_id": "REAL-A-20260812",
    "psd_path_windows": "D:\\Downloads\\a.psd",
    "reference_png_path_windows": "D:\\Downloads\\20260812.png",
    "read_only": true,
    "commit_inputs_or_full_renders": false,
    "identity_status": "verified",
    "normalization_status": "verified",
    "psd_sha256": "574d8a6511b2aabe744835d81ed76c8fc8ffd0c9c5678f3359e8eda10f9174db",
    "reference_png_sha256": "91ff8daef941b3d9052497190fdc8aa6f4d56ba524c8d912cf011b6818535f54"
  },
  "active_task_id": "PARITY-002",
  "task_contract": ".control/CURRENT_GOAL.md",
  "tasks": [
    {
      "id": "PARITY-001",
      "status": "done",
      "requires": [],
      "verification": "pass",
      "branch": "codex/parity-001",
      "commit": "20e4bd0df77bd2d1fe2c041f70bdf27471738f29",
      "evidence": [".control/evidence/PARITY-001/20260902-132200/summary.json"]
    },
    {
      "id": "PARITY-002",
      "status": "awaiting_verification",
      "requires": [
        "PARITY-001"
      ],
      "verification": "pending",
      "branch": "codex/parity-002",
      "commit": "686bf73ecdeedb491f5ee4b9be058dc88eeec759",
      "evidence": [".control/evidence/PARITY-002/20260902-140000/summary.json"]
    },
    {
      "id": "PARITY-003",
      "status": "blocked",
      "requires": [
        "PARITY-002"
      ],
      "verification": "pending",
      "branch": null,
      "commit": null,
      "evidence": []
    },
    {
      "id": "PARITY-004",
      "status": "blocked",
      "requires": [
        "PARITY-003"
      ],
      "verification": "pending",
      "branch": null,
      "commit": null,
      "evidence": []
    },
    {
      "id": "PARITY-005",
      "status": "blocked",
      "requires": [
        "PARITY-004"
      ],
      "verification": "pending",
      "branch": null,
      "commit": null,
      "evidence": []
    },
    {
      "id": "PARITY-006",
      "status": "blocked",
      "requires": [
        "PARITY-004"
      ],
      "verification": "pending",
      "branch": null,
      "commit": null,
      "evidence": []
    },
    {
      "id": "PARITY-007",
      "status": "blocked",
      "requires": [
        "PARITY-005",
        "PARITY-006"
      ],
      "verification": "pending",
      "branch": null,
      "commit": null,
      "evidence": []
    }
  ],
  "transition_rule": "Worker submits awaiting_verification; a fresh verifier PASS is required before done or advancing active_task_id."
}
